{
 "schema_version": "review_document.v1",
 "meta": {
  "deck_id": "archidekt:417248",
  "deck_name": "No The Other Frozen Throne",
  "commanders": [
   {
    "name": "Darien, King of Kjeldor",
    "oracle_id": "d05336cb-6157-47e7-942f-43becd67a5bf"
   }
  ],
  "generated_at": "2026-10-29T01:22:07.897385+00:00",
  "pipeline_version": "review-ab-1",
  "prompt_versions": {
   "A": "v1",
   "B": "v1",
   "C": "v1",
   "D": "v1",
   "E": "v1",
   "critic": "v1"
  },
  "models": {
   "A": "spoton:claude-sonnet-5-5",
   "B": "spoton:claude-sonnet-5-5",
   "C": "spoton:claude-sonnet-5-5",
   "D": "spoton:claude-sonnet-5-5",
   "E": "spoton:claude-sonnet-5-5",
   "critic": "spoton:mistral-large-3"
  },
  "fact_pack_hash": "031c58321a2aa1a42f7648947dbe1f7a1f2011c4e582b69f11a727f28a75d77a"
 },
 "verdict": {
  "headline": "Solid mono-white Soldier go-wide engine, held back by thin card flow, thin ramp and a weak Darien damage half",
  "summary": "The token core works. Makers like Hero of Bladehold, Captain of the Watch, Mobilization and Elspeth, Sun's Champion feed Anointed Procession and Myrel, and the payoffs (Elesh Norn, Field Marshal, Coat of Arms, True Conviction) turn the wide board lethal in one or two attacks. Most of the sweepers spare the Soldiers, and the protection covers Darien and the board. The problems are structural. Draw is 6 against an 11-13 target, tagged ramp is 3 against 9-11, and there are no tutors, so the single-copy engines are hard to find. Darien's self-damage side relies on few real sources. Spot removal is 6 against an 11-13 target, with no real answer to a resolved enchantment or artifact. 22 orphan cards and a synergy density of 0.2333 dilute the concept. Wrath of God and Austere Command also cut against the board. The floor is bracket 3, set solely by Smothering Tithe.",
  "grade": "C",
  "confidence": 0.57
 },
 "deck_identity": {
  "what_it_does": "No owner intent is recorded, so this is read from the list. It is a mono-white Soldier token deck. Kjeldoran Outpost, Mobilization, Captain of the Watch, Hero of Bladehold, Myrel, Shield of Argive and the two Elspeths make bodies, and Anointed Procession doubles them. Anthems and lords (Elesh Norn, Grand Cenobite, Field Marshal, Glorious Anthem, Marshal's Anthem, Coat of Arms) turn the wide board into lethal attacks. Darien, King of Kjeldor adds a self-damage angle, since damage dealt to you becomes Soldiers. Blood of the Martyr, Jade Monolith and painful lands back it up.",
  "win_paths": [
   "Wide Soldier combat: tokens plus anthems and lords attack together. Hero of Bladehold's battle cry, Myrel's token doubling, Odric's forced blocks and True Conviction's double strike and lifelink close the game.",
   "Darien damage engine: self-damage or redirected damage becomes that many Soldiers (doubled by Anointed Procession), feeding the wide board.",
   "Halo Fountain alternate win by untapping fifteen creatures, which the token count makes plausible. It is slow, and so is the incremental reach.",
   "Incremental reach and removal from the token count: Catapult Master exiling creatures by tapping five Soldiers, Dingus Staff pings, and Suture Priest drain."
  ],
  "success_criteria": [
   "Soldier production starts early and keeps going. The cheap makers (Precinct Captain, Kjeldoran Outpost, Mobilization, Martial Coup, Elspeth Tirel) and the 4-6 mana makers (Hero of Bladehold, Knight-Captain of Eos, Captain of the Watch) give a wide board by mid-game.",
   "Darien's trigger does real work most games. Enough self-damage sources (Tarnished Citadel, City of Brass, Nomad Stadium, Grand Coliseum, Blood of the Martyr, Jade Monolith) are needed so Soldiers do not depend on opponents attacking.",
   "Enough Soldier payoffs (Captain of the Watch, Field Marshal, Heidegger, Shinra Executive, Myrel, Shield of Argive, Catapult Master) and generic anthems that a typical token board is lethal within a couple of attack steps.",
   "The wipes reset the table without killing the plan. Hour of Reckoning, Mass Calcify, Martial Coup and Elspeth, Sun's Champion leave white tokens alive. Wrath of God and Austere Command should be checked against that.",
   "The deck refuels after a wipe or while building. Skullclamp, Mentor of the Meek, Dawn of a New Age, Haliya, Guided by Light, Halo Fountain and Smothering Tithe keep cards flowing.",
   "Darien and the key engines survive. Bastion Protector, Swiftfoot Boots, Flawless Maneuver and Boromir, Warden of the Tower cover the commander and the board against removal and sweepers."
  ],
  "intentional_quirks": [
   "Painful lands and damage redirection in a mono-white deck, where they add no colors.",
   "All basics are Snow-Covered Plains, alongside snow utility lands.",
   "Very high land count with many utility lands and mana sinks, and little traditional ramp.",
   "Heavy lifegain-trigger package of small creatures that do little else.",
   "Several sweepers in a creature deck, most of them token-friendly."
  ]
 },
 "scorecard": [
  {
   "axis": "plan_synergy",
   "score": 6,
   "one_line": "Token makers, Anointed Procession and Myrel form a real engine (synergy.clusters.tokens.support = 14.0), but Darien's damage half runs on thin redirection and Wrath of God/Austere Command cut against the board.",
   "finding_ids": [
    "s-plan_synergy-1",
    "s-plan_synergy-2",
    "s-plan_synergy-3",
    "p-plan_synergy-2",
    "p-plan_synergy-3",
    "p-plan_synergy-4"
   ]
  },
  {
   "axis": "mana_consistency",
   "score": 7,
   "one_line": "38 lands matches the 38 target (mana.lands) and W sources sit at 35 of 36 recommended, but draw is 6 against a 11-13 target and the six-plus-mana top end has little ramp beyond lands.",
   "finding_ids": [
    "s-mana_consistency-1",
    "s-mana_consistency-2",
    "s-mana_consistency-3",
    "p-mana_consistency-1",
    "p-mana_consistency-2",
    "p-mana_consistency-3"
   ]
  },
  {
   "axis": "interaction_resilience",
   "score": 6,
   "one_line": "Seven sweepers (roles.wipes.count) and five protection pieces cover resets and Darien well, but spot removal sits at 6 against an 11-13 target and the deck has no real answer to a resolved enchantment or artifact.",
   "finding_ids": [
    "s-interaction_resilience-1",
    "s-interaction_resilience-2",
    "s-interaction_resilience-3",
    "p-interaction_resilience-2",
    "p-interaction_resilience-3",
    "p-interaction_resilience-4"
   ]
  },
  {
   "axis": "win_paths_closing",
   "score": 7,
   "one_line": "Wide-combat plan has many redundant carriers (Hero of Bladehold, Myrel, Elesh Norn, True Conviction) and combos.counts.complete = 0 is fine for a go-wide deck, but a single sweeper hurts and there are no tutors (roles.tutors.count = 0).",
   "finding_ids": [
    "s-win_paths_closing-1",
    "s-win_paths_closing-2",
    "s-win_paths_closing-3",
    "p-win_paths_closing-1",
    "p-win_paths_closing-2",
    "p-win_paths_closing-3"
   ]
  },
  {
   "axis": "power_bracket",
   "score": 7,
   "one_line": "Floor is bracket 3 solely from Smothering Tithe (bracket.minimum_bracket = 3) with no combos or tutors; the target is unstated, so fit cannot be judged beyond that.",
   "finding_ids": [
    "s-power_bracket-1",
    "s-power_bracket-2",
    "p-power_bracket-1",
    "p-power_bracket-2"
   ]
  },
  {
   "axis": "budget_inventory",
   "score": 7,
   "one_line": "No cap is set and inventory is unavailable, so only cost-efficiency can be judged; Anointed Procession ($59.29) is central to the plan, but Extraplanar Lens ($14.92) and Nykthos ($44.36) are the weaker spends.",
   "finding_ids": [
    "s-budget_inventory-1",
    "s-budget_inventory-2",
    "p-budget_inventory-1",
    "p-budget_inventory-3"
   ]
  },
  {
   "axis": "concept_execution",
   "score": 6,
   "one_line": "Token makers plus Anointed Procession and anthems execute the go-wide half well, but Darien's damage half leans on few real sources and 22 orphan cards dilute the concept (synergy.orphans).",
   "finding_ids": [
    "s-concept_execution-1",
    "s-concept_execution-2",
    "s-concept_execution-3",
    "p-concept_execution-1",
    "p-concept_execution-2",
    "p-concept_execution-3",
    "p-concept_execution-4"
   ]
  }
 ],
 "strengths": [
  {
   "id": "s-mana_consistency-1",
   "axis": "mana_consistency",
   "claim": "The land count is exactly at the norm (38 against a 38 target) in a mono-white deck, with 35 white sources against 36 recommended for 80 white pips. Almost no color risk, and the brief marks the high land count with mana-sink lands as deliberate: Kjeldoran Outpost, Faceless Haven and Forbidding Watchtower turn excess lands into Soldiers or creatures.",
   "evidence": {
    "cards": [
     {
      "name": "Kjeldoran Outpost",
      "oracle_id": "8b370db5-dfb9-4ea0-9017-bae3e767b041"
     },
     {
      "name": "Faceless Haven",
      "oracle_id": "f74107d5-fb4a-464b-9251-42b84d91775d"
     },
     {
      "name": "Forbidding Watchtower",
      "oracle_id": "cabf7953-0fac-4dbb-b3ae-05e85e02b3fc"
     }
    ],
    "fact_keys": [
     "mana.lands",
     "mana.norms.lands.target",
     "mana.pips_vs_sources.W.sources",
     "mana.pips_vs_sources.W.recommended_sources"
    ]
   },
   "severity": "high",
   "confidence": 0.85
  },
  {
   "id": "s-interaction_resilience-1",
   "axis": "interaction_resilience",
   "claim": "Sweepers are mostly one-sided for a white Soldier board: Hour of Reckoning spares tokens, Mass Calcify spares white creatures, Martial Coup leaves its new tokens, and Elspeth, Sun's Champion kills only power 4+. Together they reset the table while the plan survives.",
   "evidence": {
    "cards": [
     {
      "name": "Hour of Reckoning",
      "oracle_id": "3bc13640-03f8-4b19-b0a4-7e7cb5271c0c"
     },
     {
      "name": "Mass Calcify",
      "oracle_id": "3ab3996f-aa3f-4041-8634-8e197d51f108"
     },
     {
      "name": "Martial Coup",
      "oracle_id": "2b7c4dab-e432-4b34-b058-3cec5c0d72df"
     },
     {